protein localization to chromosome (GO:0034502),0.0032660627117244785,"['RAD21', 'PLK1', 'HASPIN', 'CENPA']",2.485975480623718,foldChange,Protein localization to chromosome ,4
mitotic G1 DNA damage checkpoint signaling (GO:0031571),0.004394168170896513,"['CCNB1', 'CDK1', 'GTSE1', 'AURKA', 'E2F8']",2.3571233260466498,foldChange,Mitotic g1 dna damage checkpoint signaling ,5
protein phosphorylation (GO:0006468),0.004414483910858767,"['PLK4', 'PLK1', 'TTK', 'HASPIN', 'AURKB', 'AURKA', 'CDC25B', 'CCNA2', 'INCENP', 'CDK1', 'BIRC5', 'NEK2', 'PIM2', 'CDK5R1']",2.355120061682626,foldChange,Protein phosphorylation ,14
DNA conformation change (GO:0071103),0.00643156332932898,"['TOP2A', 'HMGB2', 'HMGB3']",2.1916834496608195,foldChange,Dna conformation change ,3
regulation of DNA recombination (GO:0000018),0.007148710732247788,"['RAD51AP1', 'H1-5', 'KPNA2', 'H1-2']",2.1457722760112707,foldChange,Regulation of dna recombination ,4
protein modification by small protein conjugation (GO:0032446),0.0077598439841602305,"['H2BC12', 'H2BC9', 'H2BC13', 'H2BC14', 'UBE2C', 'UBE2S', 'RNF26', 'H2BC3', 'PLK1', 'CCNF', 'RANGAP1', 'H2BC17']",2.1101470103783373,foldChange,Protein modification by small protein conjugation ,12
positive regulation of protein kinase activity (GO:0045860),0.008072322957805227,"['TPX2', 'CENPE', 'HSP90AA1', 'BORA', 'INCENP', 'KIF14', 'ECT2']",2.093001471153341,foldChange,Positive regulation of protein kinase activity ,7
meiotic sister chromatid segregation (GO:0045144),0.008352958650759638,"['SGO1', 'SGO2']",2.0781596684554335,foldChange,Meiotic sister chromatid segregation ,2
trophoblast giant cell differentiation (GO:0060707),0.008352958650759638,"['PLK4', 'E2F8']",2.0781596684554335,foldChange,Trophoblast giant cell differentiation ,2
mitotic G2/M transition checkpoint (GO:0044818),0.008909097327933704,"['FZR1', 'PLK1', 'CDK1', 'TICRR']",2.050166296564332,foldChange,Mitotic g2/m transition checkpoint ,4
regulation of DNA metabolic process (GO:0051052),0.00950361245698318,"['PIF1', 'KPNA2', 'POLH', 'TICRR']",2.022111281877331,foldChange,Regulation of dna metabolic process ,4
regulation of telomerase activity (GO:0051972),0.00950361245698318,"['PIF1', 'HSP90AA1', 'NEK2', 'AURKB']",2.022111281877331,foldChange,Regulation of telomerase activity ,4
protein localization to chromatin (GO:0071168),0.00950361245698318,"['H1-5', 'RAD21', 'PLK1']",2.022111281877331,foldChange,Protein localization to chromatin ,3
cytokine-mediated signaling pathway (GO:0019221),2.0062029668906712e-14,"['IFITM1', 'TNFRSF13C', 'HSP90B1', 'PSMB4', 'UBB', 'HNRNPDL', 'TMSB4X', 'MYC', 'UBC', 'TNFRSF17', 'B2M', 'JUNB', 'HLA-DPA1', 'EIF5A', 'HSPA8', 'EGR1', 'HSP90AA1', 'CCL22', 'HLA-B', 'HLA-C', 'MIF', 'HLA-A', 'PSMB8', 'HLA-E', 'BST2', 'NFKBIA', 'FCER2', 'CXCL10', 'IRF4', 'HNRNPA2B1', 'TCP1', 'LTA', 'HLA-DRA', 'BIRC5', 'LCP1', 'UBA52']",13.697625131663779,raw,Cytokine-mediated signaling pathway ,36
negative regulation of programmed cell death (GO:0043069),7.292607645569476e-10,"['CD74', 'PRELID1', 'ARL6IP1', 'HSPA5', 'GSTP1', 'PLK1', 'LAPTM5', 'HSPB1', 'MIF', 'PHB2', 'HIGD2A', 'HSP90B1', 'NFKBIA', 'HNRNPK', 'UBB', 'ARHGDIA', 'MYC', 'UBC', 'CDK1', 'BIRC5', 'PIM2', 'PTMA', 'UBA52', 'TPT1']",9.137117151574515,raw,Negative regulation of programmed cell death ,24
regulation of apoptotic process (GO:0042981),1.7770056706089433e-09,"['TOP2A', 'ARL6IP1', 'GSTP1', 'HSPB1', 'PHB2', 'HSP90B1', 'LGALS1', 'UBB', 'ARHGDIA', 'MYC', 'UBC', 'RACK1', 'PIM2', 'CD74', 'PRELID1', 'HSP90AA1', 'HSPA5', 'GADD45B', 'PLK1', 'MIF', 'HIGD2A', 'NFKBIA', 'CXCL10', 'HNRNPK', 'APEX1', 'CDK1', 'BIRC5', 'CALR', 'PTMA', 'UBA52', 'TPT1', 'ATF4']",8.750311186313864,raw,Regulation of apoptotic process ,32
negative regulation of apoptotic process (GO:0043066),9.542658443207808e-09,"['ARL6IP1', 'GSTP1', 'HSPB1', 'PHB2', 'HSP90B1', 'UBB', 'ARHGDIA', 'MYC', 'UBC', 'PIM2', 'CD74', 'PRELID1', 'GPX1', 'HSPA5', 'PLK1', 'MIF', 'HIGD2A', 'NFKBIA', 'SFPQ', 'HNRNPK', 'CDK1', 'BIRC5', 'PTMA', 'UBA52', 'TPT1']",8.020330620434185,raw,Negative regulation of apoptotic process ,25
anaphase-promoting complex-dependent catabolic process (GO:0031145),1.6429814872734785e-08,"['CDC20', 'CCNB1', 'PSMB4', 'UBB', 'UBE2C', 'UBC', 'PLK1', 'CDK1', 'BUB3', 'UBA52', 'AURKB', 'PSMB8']",7.784367330064798,raw,Anaphase-promoting complex-dependent catabolic process ,12
regulation of mitotic cell cycle phase transition (GO:1901990),2.2942465593060571e-07,"['HSP90AA1', 'UBE2C', 'TUBB', 'PLK1', 'TUBB4B', 'PSMB8', 'CDC20', 'CCNB1', 'PSMB4', 'TUBA1A', 'UBB', 'UBC', 'CDK1', 'BUB3', 'UBA52']",6.639359910936911,raw,Regulation of mitotic cell cycle phase transition ,15
DNA metabolic process (GO:0006259),8.003754701290151e-07,"['TOP2A', 'BTG2', 'FEN1', 'PCNA', 'MCM7', 'HMGB2', 'UBB', 'TRIM28', 'APEX1', 'RAD21', 'UBC', 'POLE3', 'CDK1', 'MCM4', 'KPNA2', 'UBA52', 'RAN']",6.096706230069382,raw,Dna metabolic process ,17
"antigen processing and presentation of exogenous peptide antigen via MHC class I, TAP-independent (GO:0002480)",1.2351294713002316e-06,"['HLA-B', 'HLA-C', 'HLA-A', 'B2M', 'HLA-E']",5.908287515502216,raw,"Antigen processing and presentation of exogenous peptide antigen via mhc class i, tap-independent ",5
cellular response to type I interferon (GO:0071357),3.1283489127259633e-06,"['BST2', 'EGR1', 'IFITM1', 'IRF4', 'HLA-B', 'HLA-C', 'HLA-A', 'PSMB8', 'HLA-E']",5.504684814940538,raw,Cellular response to type i interferon ,9
type I interferon signaling pathway (GO:0060337),3.1283489127259633e-06,"['BST2', 'EGR1', 'IFITM1', 'IRF4', 'HLA-B', 'HLA-C', 'HLA-A', 'PSMB8', 'HLA-E']",5.504684814940538,raw,Type i interferon signaling pathway ,9
modulation by symbiont of host process (GO:0044003),3.9769521959263285e-06,"['UBB', 'UBC', 'ENO1', 'B2M', 'UBA52']",5.400449629323345,raw,Modulation by symbiont of host process ,5
regulation of mitotic cell cycle (GO:0007346),4.671531284563825e-06,"['BTG2', 'BTG1', 'UBE2C', 'PLK1', 'MKI67', 'PSMB8', 'CDC20', 'CCNB1', 'PSMB4', 'CDK1', 'CKS2', 'PIM2', 'BUB3']",5.330540738399774,raw,Regulation of mitotic cell cycle ,13
regulation of exit from mitosis (GO:0007096),1.5438484960590322e-05,"['CDC20', 'UBB', 'UBE2C', 'UBC', 'BUB3', 'PHB2', 'UBA52']",4.811395320939349,raw,Regulation of exit from mitosis ,7
"mRNA splicing, via spliceosome (GO:0000398)",1.5851140255080483e-05,"['SRRM2', 'DDX17', 'HSPA8', 'SF3B5', 'DDX5', 'FUS', 'PNN', 'SFPQ', 'HNRNPK', 'HNRNPH1', 'PCBP1', 'HNRNPA2B1', 'SRSF2', 'SRSF3', 'HNRNPA1']",4.799939491258368,raw,"Mrna splicing, via spliceosome ",15
regulation of translation (GO:0006417),2.9571740388034185e-05,"['EIF4A2', 'RBM3', 'BTG2', 'SHMT2', 'NCL', 'RACK1', 'HSPB1', 'CALR', 'EEF2', 'GAPDH', 'EIF4G2', 'EIF1']",4.529123115153375,raw,Regulation of translation ,12
"RNA splicing, via transesterification reactions with bulged adenosine as nucleophile (GO:0000377)",2.9571740388034185e-05,"['SRRM2', 'HSPA8', 'SF3B5', 'DDX5', 'FUS', 'PNN', 'SFPQ', 'HNRNPK', 'HNRNPH1', 'PCBP1', 'HNRNPA2B1', 'SRSF2', 'SRSF3', 'HNRNPA1']",4.529123115153375,raw,"Rna splicing, via transesterification reactions with bulged adenosine as nucleophile ",14
antigen processing and presentation of endogenous peptide antigen via MHC class I via ER pathway (GO:0002484),3.0544683963245033e-05,"['HLA-B', 'HLA-C', 'HLA-A', 'HLA-E']",4.515064364024485,raw,Antigen processing and presentation of endogenous peptide antigen via mhc class i via er pathway ,4
"antigen processing and presentation of endogenous peptide antigen via MHC class I via ER pathway, TAP-independent (GO:0002486)",3.0544683963245033e-05,"['HLA-B', 'HLA-C', 'HLA-A', 'HLA-E']",4.515064364024485,raw,"Antigen processing and presentation of endogenous peptide antigen via mhc class i via er pathway, tap-independent ",4
response to host defenses (GO:0052200),3.0544683963245033e-05,"['UBB', 'UBC', 'B2M', 'UBA52']",4.515064364024485,raw,Response to host defenses ,4
modulation by symbiont of host defense response (GO:0052031),3.0544683963245033e-05,"['UBB', 'UBC', 'B2M', 'UBA52']",4.515064364024485,raw,Modulation by symbiont of host defense response ,4
glycolytic process (GO:0006096),3.0544683963245033e-05,"['LDHA', 'TPI1', 'PKM', 'ALDOC', 'ENO1', 'GAPDH']",4.515064364024485,raw,Glycolytic process ,6
mRNA processing (GO:0006397),3.0544683963245033e-05,"['SRRM2', 'HSPA8', 'SF3B5', 'DDX5', 'FUS', 'PNN', 'SFPQ', 'HNRNPK', 'HNRNPH1', 'PCBP1', 'HNRNPA2B1', 'SRSF2', 'SRSF3', 'AURKAIP1', 'HNRNPA1']",4.515064364024485,raw,Mrna processing ,15
interferon-gamma-mediated signaling pathway (GO:0060333),3.0544683963245033e-05,"['IRF4', 'HLA-B', 'HLA-C', 'HLA-DRA', 'HLA-A', 'B2M', 'HLA-DPA1', 'HLA-E']",4.515064364024485,raw,Interferon-gamma-mediated signaling pathway ,8
cellular response to interferon-gamma (GO:0071346),3.0544683963245033e-05,"['CCL22', 'IRF4', 'HLA-B', 'HLA-C', 'HLA-DRA', 'HLA-A', 'B2M', 'GAPDH', 'HLA-E', 'HLA-DPA1']",4.515064364024485,raw,Cellular response to interferon-gamma ,10
nucleic acid metabolic process (GO:0090304),4.100588351513198e-05,"['FEN1', 'HNRNPK', 'HNRNPH1', 'PCBP1', 'HNRNPA2B1', 'KPNA2', 'HNRNPA1', 'RAN']",4.387153826332971,raw,Nucleic acid metabolic process ,8
"antigen processing and presentation of exogenous peptide antigen via MHC class I, TAP-dependent (GO:0002479)",4.897356737356252e-05,"['PSMB4', 'HLA-B', 'HLA-C', 'HLA-A', 'CALR', 'B2M', 'PSMB8', 'HLA-E']",4.310038259587574,raw,"Antigen processing and presentation of exogenous peptide antigen via mhc class i, tap-dependent ",8
DNA duplex unwinding (GO:0032508),5.055678520828528e-05,"['PIF1', 'MCM7', 'UBB', 'UBC', 'HMGA1', 'MCM4', 'UBA52']",4.2962205496523085,raw,Dna duplex unwinding ,7
antigen processing and presentation of peptide antigen via MHC class I (GO:0002474),5.569863520464711e-05,"['HLA-B', 'HLA-C', 'HLA-A', 'CALR', 'B2M', 'HLA-E']",4.254155446304771,raw,Antigen processing and presentation of peptide antigen via mhc class i ,6
regulation of cell division (GO:0051302),6.003414222866333e-05,"['MYC', 'PLK1', 'RACK1', 'TXNIP', 'CALM3', 'KIF20A', 'CALM2', 'AURKB']",4.221601690210875,raw,Regulation of cell division ,8
antigen processing and presentation of exogenous peptide antigen via MHC class I (GO:0042590),7.094189365238302e-05,"['PSMB4', 'HLA-B', 'HLA-C', 'HLA-A', 'CALR', 'B2M', 'PSMB8', 'HLA-E']",4.149097223084202,raw,Antigen processing and presentation of exogenous peptide antigen via mhc class i ,8
regulation of cell cycle (GO:0051726),0.0001037662899961217,"['HSP90AB1', 'JUND', 'GADD45B', 'PLK1', 'MIF', 'CCNB1', 'MYC', 'RACK1', 'CKS2', 'BIRC5', 'CALR', 'PIM2', 'JUNB', 'EIF4G2']",3.9839437105187026,raw,Regulation of cell cycle ,14
protein-DNA complex assembly (GO:0065004),0.0001037662899961217,"['H2AX', 'H2BC12', 'PSMB4', 'UBB', 'MCM7', 'UBC', 'HMGB2', 'MCM4', 'UBA52', 'PSMB8']",3.9839437105187026,raw,Protein-dna complex assembly ,10
cellular response to cytokine stimulus (GO:0071345),0.0001037662899961217,"['HSPA8', 'EGR1', 'HSP90AA1', 'CCL22', 'HSP90B1', 'FCER2', 'CXCL10', 'ZFP36', 'UBB', 'IRF4', 'MYC', 'UBC', 'BIRC5', 'CCR7', 'GAPDH', 'JUNB', 'UBA52', 'HLA-DPA1']",3.9839437105187026,raw,Cellular response to cytokine stimulus ,18
regulation of immune response (GO:0050776),0.0001089180590663554,"['SPN', 'IFITM1', 'IRF4', 'HLA-B', 'HLA-C', 'SLAMF7', 'HLA-DRA', 'HLA-A', 'B2M', 'CD22', 'HLA-E']",3.962900106445938,raw,Regulation of immune response ,11
regulation of mRNA stability (GO:0043488),0.00011802844764253868,"['HSPA8', 'ZFP36', 'PSMB4', 'UBB', 'FUS', 'APEX1', 'UBC', 'HSPB1', 'UBA52', 'PSMB8']",3.9280133048533967,raw,Regulation of mrna stability ,10
positive regulation of DNA biosynthetic process (GO:2000573),0.00013131731910840825,"['HSP90AA1', 'HSP90AB1', 'PCNA', 'MYC', 'TCP1', 'HNRNPA1', 'AURKB']",3.8816779921345157,raw,Positive regulation of dna biosynthetic process ,7
carbohydrate catabolic process (GO:0016052),0.00016010532390570685,"['LDHA', 'TPI1', 'PKM', 'ALDOC', 'ENO1', 'GAPDH']",3.7955942264540425,raw,Carbohydrate catabolic process ,6
pre-replicative complex assembly (GO:0036388),0.00016460349461682952,"['PSMB4', 'MCM7', 'UBB', 'UBC', 'MCM4', 'UBA52', 'PSMB8']",3.783560948730708,raw,Pre-replicative complex assembly ,7
canonical glycolysis (GO:0061621),0.00016460349461682952,"['TPI1', 'PKM', 'ALDOC', 'ENO1', 'GAPDH']",3.783560948730708,raw,Canonical glycolysis ,5
glucose catabolic process to pyruvate (GO:0061718),0.00016460349461682952,"['TPI1', 'PKM', 'ALDOC', 'ENO1', 'GAPDH']",3.783560948730708,raw,Glucose catabolic process to pyruvate ,5
cellular macromolecule biosynthetic process (GO:0034645),0.00016508171372218148,"['PIF1', 'FEN1', 'MCM7', 'EEF2', 'TUFM', 'EEF1B2', 'MRPL41', 'FAM111A', 'MRPL51', 'POLE3', 'CDK1', 'MCM4', 'PTMA', 'EIF4G2']",3.7823010313367598,raw,Cellular macromolecule biosynthetic process ,14
regulation of mRNA catabolic process (GO:0061013),0.00017407002055659038,"['HSPA8', 'ZFP36', 'PSMB4', 'UBB', 'APEX1', 'UBC', 'HSPB1', 'UBA52', 'PSMB8']",3.759276019393665,raw,Regulation of mrna catabolic process ,9
glycolytic process through glucose-6-phosphate (GO:0061620),0.0001898501496173833,"['TPI1', 'PKM', 'ALDOC', 'ENO1', 'GAPDH']",3.7215890562646194,raw,Glycolytic process through glucose-6-phosphate ,5
proteasome-mediated ubiquitin-dependent protein catabolic process (GO:0043161),0.00019833066175664938,"['HSPA5', 'UBE2C', 'PLK1', 'AURKB', 'PSMB8', 'HSP90B1', 'CDC20', 'CCNB1', 'PSMB4', 'UBB', 'UBC', 'CDK1', 'BUB3', 'UBA52']",3.702610139035615,raw,Proteasome-mediated ubiquitin-dependent protein catabolic process ,14
regulation of cell cycle phase transition (GO:1901987),0.00021209964557335597,"['CDC20', 'CCNB1', 'PSMB4', 'UBE2C', 'PLK1', 'CDK1', 'BUB3', 'PSMB8']",3.673460057205571,raw,Regulation of cell cycle phase transition ,8
chromosome condensation (GO:0030261),0.0002256563181100422,"['TOP2A', 'CCNB1', 'PLK1', 'CDK1', 'BANF1', 'H1-2']",3.646552502241714,raw,Chromosome condensation ,6
DNA-dependent DNA replication (GO:0006261),0.00024160179563290307,"['PSMB4', 'UBB', 'MCM7', 'UBC', 'POLE3', 'HMGA1', 'MCM4', 'UBA52', 'PSMB8']",3.6168998422753953,raw,Dna-dependent dna replication ,9
regulation of B cell proliferation (GO:0030888),0.00024160179563290307,"['CD74', 'GPR183', 'MZB1', 'TNFRSF13C', 'MIF', 'CD22']",3.6168998422753953,raw,Regulation of b cell proliferation ,6
regulation of telomerase activity (GO:0051972),0.00024160179563290307,"['PIF1', 'HSP90AA1', 'HSP90AB1', 'MYC', 'TCP1', 'AURKB']",3.6168998422753953,raw,Regulation of telomerase activity ,6
mitotic cell cycle phase transition (GO:0044772),0.0003286897670228736,"['CCNA2', 'CCNB1', 'HSP90AA1', 'TUBA1A', 'UBE2C', 'TUBB', 'MYC', 'PLK1', 'CDK1', 'PIM2', 'TUBB4B']",3.483213816437625,raw,Mitotic cell cycle phase transition ,11
antigen processing and presentation of endogenous peptide antigen (GO:0002483),0.0003347320437379955,"['HLA-DRA', 'HLA-A', 'B2M', 'HLA-E']",3.475302710849681,raw,Antigen processing and presentation of endogenous peptide antigen ,4
translational elongation (GO:0006414),0.00035566746368299586,"['EEF1B2', 'MRPL41', 'MRPL51', 'MRPS34', 'RACK1', 'AURKAIP1', 'EEF2', 'TUFM']",3.4489558620822423,raw,Translational elongation ,8
positive regulation of lymphocyte proliferation (GO:0050671),0.00035566746368299586,"['CD74', 'HLA-DMB', 'GPR183', 'TNFRSF13C', 'MIF', 'HLA-DPA1', 'HLA-E']",3.4489558620822423,raw,Positive regulation of lymphocyte proliferation ,7
DNA repair (GO:0006281),0.00035566746368299586,"['H2AX', 'BTG2', 'FEN1', 'PCNA', 'FAM111A', 'UBB', 'TRIM28', 'APEX1', 'RAD21', 'UBC', 'CDK1', 'KPNA2', 'UBA52']",3.4489558620822423,raw,Dna repair ,13
negative regulation of cellular macromolecule biosynthetic process (GO:2000113),0.0003574706862838781,"['HSPA8', 'BTG2', 'HMGB2', 'HMGA1', 'ENO1', 'PHB2', 'EID1', 'SFPQ', 'TRIM28', 'CCDC85B', 'NCL', 'BHLHE40', 'RACK1', 'ID3', 'BIRC5', 'CALR', 'GAPDH', 'CDK5R1']",3.446759565910799,raw,Negative regulation of cellular macromolecule biosynthetic process ,18
chromosome organization (GO:0051276),0.0003850550394511402,"['TOP2A', 'UBB', 'MYC', 'UBC', 'POLE3', 'HMGB2', 'HMGN2', 'UBA52']",3.414477188357799,raw,Chromosome organization ,8
protein deubiquitination (GO:0016579),0.0005533348494372882,"['CDC20', 'CCNA2', 'NFKBIA', 'PSMB4', 'UBB', 'SHMT2', 'MYC', 'UBC', 'CDK1', 'UBA52', 'ACTB', 'PSMB8']",3.2570119767374153,raw,Protein deubiquitination ,12
pyruvate metabolic process (GO:0006090),0.0005862459288308641,"['LDHA', 'TPI1', 'PKM', 'ALDOC', 'ENO1', 'GAPDH']",3.2319201602127747,raw,Pyruvate metabolic process ,6
positive regulation of transferase activity (GO:0051347),0.0005884613340987303,"['CD74', 'HSP90AA1', 'HSP90AB1', 'PCNA', 'MYC', 'PLK1', 'TCP1', 'HNRNPA2B1', 'AURKB']",3.2302820679764244,raw,Positive regulation of transferase activity ,9
peptide antigen assembly with MHC protein complex (GO:0002501),0.0005884613340987303,"['HLA-DMB', 'HLA-DRA', 'CALR']",3.2302820679764244,raw,Peptide antigen assembly with mhc protein complex ,3
positive regulation of tau-protein kinase activity (GO:1902949),0.0005884613340987303,"['EGR1', 'HSP90AA1', 'HSP90AB1']",3.2302820679764244,raw,Positive regulation of tau-protein kinase activity ,3
protection from natural killer cell mediated cytotoxicity (GO:0042270),0.0005884613340987303,"['HLA-B', 'HLA-A', 'HLA-E']",3.2302820679764244,raw,Protection from natural killer cell mediated cytotoxicity ,3
regulation of G2/M transition of mitotic cell cycle (GO:0010389),0.0005884613340987303,"['CCNB1', 'HSP90AA1', 'PSMB4', 'TUBA1A', 'TUBB', 'PLK1', 'CDK1', 'TUBB4B', 'PSMB8']",3.2302820679764244,raw,Regulation of g2/m transition of mitotic cell cycle ,9
positive regulation of telomerase activity (GO:0051973),0.0006209648552766534,"['HSP90AA1', 'HSP90AB1', 'MYC', 'TCP1', 'AURKB']",3.2069329788754866,raw,Positive regulation of telomerase activity ,5
tumor necrosis factor-mediated signaling pathway (GO:0033209),0.00064182810968344,"['NFKBIA', 'EIF5A', 'PSMB4', 'TMSB4X', 'LTA', 'TNFRSF17', 'TNFRSF13C', 'PSMB8']",3.192581266341368,raw,Tumor necrosis factor-mediated signaling pathway ,8
DNA strand elongation involved in DNA replication (GO:0006271),0.000756909445090567,"['PCNA', 'MCM7', 'POLE3', 'MCM4']",3.1209560753875203,raw,Dna strand elongation involved in dna replication ,4
cellular response to tumor necrosis factor (GO:0071356),0.000756909445090567,"['NFKBIA', 'EIF5A', 'PSMB4', 'ZFP36', 'CCL22', 'TMSB4X', 'LTA', 'TNFRSF17', 'TNFRSF13C', 'PSMB8']",3.1209560753875203,raw,Cellular response to tumor necrosis factor ,10
positive regulation of T cell mediated immunity (GO:0002711),0.0007790772129406581,"['HLA-B', 'HLA-DRA', 'HLA-A', 'B2M', 'HLA-E']",3.108419498049773,raw,Positive regulation of t cell mediated immunity ,5
neutrophil degranulation (GO:0043312),0.0007888704395283915,"['HSPA8', 'HSP90AA1', 'HSP90AB1', 'TUBB', 'GSTP1', 'HLA-B', 'HLA-C', 'MIF', 'TUBB4B', 'EEF2', 'BST2', 'PKM', 'IMPDH2', 'ALDOC', 'B2M', 'FTL']",3.1029943174726955,raw,Neutrophil degranulation ,16
neutrophil activation involved in immune response (GO:0002283),0.0008590942601179442,"['HSPA8', 'HSP90AA1', 'HSP90AB1', 'TUBB', 'GSTP1', 'HLA-B', 'HLA-C', 'MIF', 'TUBB4B', 'EEF2', 'BST2', 'PKM', 'IMPDH2', 'ALDOC', 'B2M', 'FTL']",3.065959182614377,raw,Neutrophil activation involved in immune response ,16
"regulation of mRNA splicing, via spliceosome (GO:0048024)",0.0008931193199974441,"['RBM3', 'DDX17', 'DDX5', 'HNRNPK', 'NCL', 'SRSF3', 'HNRNPA1']",3.0490905158541626,raw,"Regulation of mrna splicing, via spliceosome ",7
neutrophil mediated immunity (GO:0002446),0.0008993919772499486,"['HSPA8', 'HSP90AA1', 'HSP90AB1', 'TUBB', 'GSTP1', 'HLA-B', 'HLA-C', 'MIF', 'TUBB4B', 'EEF2', 'BST2', 'PKM', 'IMPDH2', 'ALDOC', 'B2M', 'FTL']",3.0460509907414113,raw,Neutrophil mediated immunity ,16
interleukin-1-mediated signaling pathway (GO:0070498),0.0011456734938578353,"['NFKBIA', 'EGR1', 'PSMB4', 'UBB', 'UBC', 'UBA52', 'PSMB8']",2.940939134567351,raw,Interleukin-1-mediated signaling pathway ,7
microtubule cytoskeleton organization involved in mitosis (GO:1902850),0.0011456734938578353,"['CDC20', 'CCNB1', 'PLK1', 'BIRC5', 'BUB3', 'ZWINT', 'AURKB', 'RAN']",2.940939134567351,raw,Microtubule cytoskeleton organization involved in mitosis ,8
G2/M transition of mitotic cell cycle (GO:0000086),0.001223027640563671,"['CCNA2', 'CCNB1', 'HSP90AA1', 'TUBA1A', 'TUBB', 'PLK1', 'CDK1', 'TUBB4B']",2.912563727748154,raw,G2/m transition of mitotic cell cycle ,8
error-prone translesion synthesis (GO:0042276),0.001223027640563671,"['PCNA', 'UBB', 'UBC', 'UBA52']",2.912563727748154,raw,Error-prone translesion synthesis ,4
spindle assembly checkpoint signaling (GO:0071173),0.001223027640563671,"['CDC20', 'PLK1', 'BUB3', 'ZWINT']",2.912563727748154,raw,Spindle assembly checkpoint signaling ,4
mitotic spindle assembly checkpoint signaling (GO:0007094),0.001223027640563671,"['CDC20', 'PLK1', 'BUB3', 'ZWINT']",2.912563727748154,raw,Mitotic spindle assembly checkpoint signaling ,4
mitotic spindle checkpoint signaling (GO:0071174),0.001223027640563671,"['CDC20', 'PLK1', 'BUB3', 'ZWINT']",2.912563727748154,raw,Mitotic spindle checkpoint signaling ,4
cell cycle G2/M phase transition (GO:0044839),0.0012332619891491754,"['CCNA2', 'CCNB1', 'HSP90AA1', 'TUBA1A', 'TUBB', 'PLK1', 'CDK1', 'TUBB4B']",2.908944653854047,raw,Cell cycle g2/m phase transition ,8
regulation of cyclic-nucleotide phosphodiesterase activity (GO:0051342),0.0012332619891491754,"['RACK1', 'CALM3', 'CALM2']",2.908944653854047,raw,Regulation of cyclic-nucleotide phosphodiesterase activity ,3
gluconeogenesis (GO:0006094),0.0012332619891491754,"['TPI1', 'ALDOC', 'ENO1', 'GAPDH', 'ATF4']",2.908944653854047,raw,Gluconeogenesis ,5
error-free translesion synthesis (GO:0070987),0.0013784578338035189,"['PCNA', 'UBB', 'UBC', 'UBA52']",2.8606065141621513,raw,Error-free translesion synthesis ,4
natural killer cell mediated cytotoxicity (GO:0042267),0.0013784578338035189,"['TUBB', 'SLAMF7', 'TUBB4B', 'CORO1A']",2.8606065141621513,raw,Natural killer cell mediated cytotoxicity ,4
negative regulation of mitotic metaphase/anaphase transition (GO:0045841),0.0013784578338035189,"['CDC20', 'PLK1', 'BUB3', 'ZWINT']",2.8606065141621513,raw,Negative regulation of mitotic metaphase/anaphase transition ,4
negative regulation of nucleic acid-templated transcription (GO:1903507),0.0015591633067129666,"['EIF4A2', 'HSPA8', 'HMGB2', 'HMGA1', 'ENO1', 'PHB2', 'EID1', 'SFPQ', 'TRIM28', 'CCDC85B', 'BHLHE40', 'ID3', 'BIRC5', 'CALR', 'CDK5R1']",2.8071083944391746,raw,Negative regulation of nucleic acid-templated transcription ,15
negative regulation of viral process (GO:0048525),0.0015610931793578157,"['BST2', 'FAM111A', 'IFITM1', 'ZFP36', 'TRIM28', 'BANF1']",2.806571173764497,raw,Negative regulation of viral process ,6
hexose biosynthetic process (GO:0019319),0.001625381201225372,"['TPI1', 'ALDOC', 'ENO1', 'GAPDH', 'ATF4']",2.7890447675014234,raw,Hexose biosynthetic process ,5
ATF6-mediated unfolded protein response (GO:0036500),0.0016578222092559316,"['HSPA5', 'CALR', 'HSP90B1']",2.7804620465717895,raw,Atf6-mediated unfolded protein response ,3
antigen processing and presentation of exogenous peptide antigen (GO:0002478),0.0016578222092559316,"['CD74', 'HLA-DMB', 'HLA-DRA', 'HLA-A', 'HLA-DOA', 'HLA-E', 'HLA-DPA1']",2.7804620465717895,raw,Antigen processing and presentation of exogenous peptide antigen ,7
"negative regulation of transcription, DNA-templated (GO:0045892)",0.0016578222092559316,"['HSPA8', 'DDX5', 'PLK1', 'HMGB2', 'HMGA1', 'ENO1', 'PHB2', 'AURKB', 'EID1', 'ZFP36', 'SFPQ', 'UBB', 'TRIM28', 'CCDC85B', 'MYC', 'UBC', 'BHLHE40', 'ID3', 'BIRC5', 'CALR', 'UBA52', 'ATF4', 'CDK5R1']",2.7804620465717895,raw,"Negative regulation of transcription, dna-templated ",23
protein stabilization (GO:0050821),0.0016757782791162643,"['HSP90AA1', 'HSP90AB1', 'TCP1', 'PIM2', 'CALR', 'PFN1', 'PPIB', 'PHB2', 'GAPDH']",2.7757834430602872,raw,Protein stabilization ,9
RNA processing (GO:0006396),0.0016757782791162643,"['DDX17', 'RBM3', 'SFPQ', 'HNRNPK', 'FUS', 'HNRNPH1', 'HNRNPA2B1', 'SRSF2', 'AURKAIP1']",2.7757834430602872,raw,Rna processing ,9
"nucleotide-excision repair, DNA gap filling (GO:0006297)",0.0017825458408063529,"['PCNA', 'UBB', 'UBC', 'UBA52']",2.748959292806669,raw,"Nucleotide-excision repair, dna gap filling ",4
interleukin-12-mediated signaling pathway (GO:0035722),0.0018698634420420892,"['HNRNPDL', 'HNRNPA2B1', 'TCP1', 'MIF', 'LCP1']",2.728190109256618,raw,Interleukin-12-mediated signaling pathway ,5
DNA replication (GO:0006260),0.002119101800271283,"['PIF1', 'FAM111A', 'FEN1', 'MCM7', 'POLE3', 'CDK1', 'MCM4']",2.6738481795638083,raw,Dna replication ,7
protein modification by small protein removal (GO:0070646),0.0021553605696190497,"['CDC20', 'CCNA2', 'NFKBIA', 'PSMB4', 'UBB', 'MYC', 'UBC', 'CDK1', 'UBA52', 'ACTB', 'PSMB8']",2.666480066432747,raw,Protein modification by small protein removal ,11
regulation of tau-protein kinase activity (GO:1902947),0.0021553605696190497,"['EGR1', 'HSP90AA1', 'HSP90AB1']",2.666480066432747,raw,Regulation of tau-protein kinase activity ,3
modification-dependent macromolecule catabolic process (GO:0043632),0.0021553605696190497,"['UBB', 'UBC', 'UBA52']",2.666480066432747,raw,Modification-dependent macromolecule catabolic process ,3
cellular response to interleukin-12 (GO:0071349),0.0021833675861405565,"['HNRNPDL', 'HNRNPA2B1', 'TCP1', 'MIF', 'LCP1']",2.660873141435446,raw,Cellular response to interleukin-12 ,5
positive regulation of T cell mediated cytotoxicity (GO:0001916),0.002297857971931127,"['HLA-B', 'HLA-DRA', 'HLA-A', 'HLA-E']",2.6386768180815006,raw,Positive regulation of t cell mediated cytotoxicity ,4
response to unfolded protein (GO:0006986),0.002364597344655144,"['HSPA8', 'HSP90AA1', 'HSP90AB1', 'HSPA5', 'HSPB1']",2.6262428024451903,raw,Response to unfolded protein ,5
positive regulation of cytokine production (GO:0001819),0.002719801349977386,"['CD74', 'EGR1', 'IRF4', 'HILPDA', 'LAPTM5', 'CCR7', 'MIF', 'HLA-A', 'GAPDH', 'HLA-E', 'ATF4', 'HLA-DPA1']",2.5654628149949126,raw,Positive regulation of cytokine production ,12
